{
  "schema_version": 1,
  "registered": true,
  "target_execution_authorized": true,
  "authorization": "User selected all 42 SU2/corrected-U1 cells and authorized committed registration, validation, then execution without further confirmation.",
  "selected_target_ids": [
    "SU2:g=0.125:eta=0",
    "SU2:g=0.125:eta=0.5",
    "SU2:g=0.125:eta=1",
    "SU2:g=0.25:eta=0",
    "SU2:g=0.25:eta=0.5",
    "SU2:g=0.25:eta=1",
    "SU2:g=0.40:eta=0",
    "SU2:g=0.40:eta=0.5",
    "SU2:g=0.40:eta=1",
    "SU2:g=0.60:eta=0",
    "SU2:g=0.60:eta=0.5",
    "SU2:g=0.60:eta=1",
    "SU2:g=0.85:eta=0",
    "SU2:g=0.85:eta=0.5",
    "SU2:g=0.85:eta=1",
    "SU2:g=1.25:eta=0",
    "SU2:g=1.25:eta=0.5",
    "SU2:g=1.25:eta=1",
    "SU2:g=2.50:eta=0",
    "SU2:g=2.50:eta=0.5",
    "SU2:g=2.50:eta=1",
    "U1:g=0.125:eta=0",
    "U1:g=0.125:eta=0.5",
    "U1:g=0.125:eta=1",
    "U1:g=0.25:eta=0",
    "U1:g=0.25:eta=0.5",
    "U1:g=0.25:eta=1",
    "U1:g=0.40:eta=0",
    "U1:g=0.40:eta=0.5",
    "U1:g=0.40:eta=1",
    "U1:g=0.60:eta=0",
    "U1:g=0.60:eta=0.5",
    "U1:g=0.60:eta=1",
    "U1:g=0.85:eta=0",
    "U1:g=0.85:eta=0.5",
    "U1:g=0.85:eta=1",
    "U1:g=1.25:eta=0",
    "U1:g=1.25:eta=0.5",
    "U1:g=1.25:eta=1",
    "U1:g=2.50:eta=0",
    "U1:g=2.50:eta=0.5",
    "U1:g=2.50:eta=1"
  ],
  "cells": [
    {
      "id": "SU2:g=0.125:eta=0",
      "theory": "SU2",
      "g": "0.125",
      "eta": "0",
      "cutoffs": [
        20,
        40,
        80,
        160,
        320
      ],
      "grids": [
        600,
        1200,
        2400,
        4800
      ]
    },
    {
      "id": "SU2:g=0.125:eta=0.5",
      "theory": "SU2",
      "g": "0.125",
      "eta": "0.5",
      "cutoffs": [
        20,
        40,
        80,
        160,
        320
      ],
      "grids": [
        600,
        1200,
        2400,
        4800
      ]
    },
    {
      "id": "SU2:g=0.125:eta=1",
      "theory": "SU2",
      "g": "0.125",
      "eta": "1",
      "cutoffs": [
        20,
        40,
        80,
        160,
        320
      ],
      "grids": [
        600,
        1200,
        2400,
        4800
      ]
    },
    {
      "id": "SU2:g=0.25:eta=0",
      "theory": "SU2",
      "g": "0.25",
      "eta": "0",
      "cutoffs": [
        20,
        40,
        80,
        160,
        320
      ],
      "grids": [
        600,
        1200,
        2400,
        4800
      ]
    },
    {
      "id": "SU2:g=0.25:eta=0.5",
      "theory": "SU2",
      "g": "0.25",
      "eta": "0.5",
      "cutoffs": [
        20,
        40,
        80,
        160,
        320
      ],
      "grids": [
        600,
        1200,
        2400,
        4800
      ]
    },
    {
      "id": "SU2:g=0.25:eta=1",
      "theory": "SU2",
      "g": "0.25",
      "eta": "1",
      "cutoffs": [
        20,
        40,
        80,
        160,
        320
      ],
      "grids": [
        600,
        1200,
        2400,
        4800
      ]
    },
    {
      "id": "SU2:g=0.40:eta=0",
      "theory": "SU2",
      "g": "0.40",
      "eta": "0",
      "cutoffs": [
        20,
        40,
        80,
        160,
        320
      ],
      "grids": [
        600,
        1200,
        2400,
        4800
      ]
    },
    {
      "id": "SU2:g=0.40:eta=0.5",
      "theory": "SU2",
      "g": "0.40",
      "eta": "0.5",
      "cutoffs": [
        20,
        40,
        80,
        160,
        320
      ],
      "grids": [
        600,
        1200,
        2400,
        4800
      ]
    },
    {
      "id": "SU2:g=0.40:eta=1",
      "theory": "SU2",
      "g": "0.40",
      "eta": "1",
      "cutoffs": [
        20,
        40,
        80,
        160,
        320
      ],
      "grids": [
        600,
        1200,
        2400,
        4800
      ]
    },
    {
      "id": "SU2:g=0.60:eta=0",
      "theory": "SU2",
      "g": "0.60",
      "eta": "0",
      "cutoffs": [
        20,
        40,
        80,
        160,
        320
      ],
      "grids": [
        600,
        1200,
        2400,
        4800
      ]
    },
    {
      "id": "SU2:g=0.60:eta=0.5",
      "theory": "SU2",
      "g": "0.60",
      "eta": "0.5",
      "cutoffs": [
        20,
        40,
        80,
        160,
        320
      ],
      "grids": [
        600,
        1200,
        2400,
        4800
      ]
    },
    {
      "id": "SU2:g=0.60:eta=1",
      "theory": "SU2",
      "g": "0.60",
      "eta": "1",
      "cutoffs": [
        20,
        40,
        80,
        160,
        320
      ],
      "grids": [
        600,
        1200,
        2400,
        4800
      ]
    },
    {
      "id": "SU2:g=0.85:eta=0",
      "theory": "SU2",
      "g": "0.85",
      "eta": "0",
      "cutoffs": [
        20,
        40,
        80,
        160,
        320
      ],
      "grids": [
        600,
        1200,
        2400,
        4800
      ]
    },
    {
      "id": "SU2:g=0.85:eta=0.5",
      "theory": "SU2",
      "g": "0.85",
      "eta": "0.5",
      "cutoffs": [
        20,
        40,
        80,
        160,
        320
      ],
      "grids": [
        600,
        1200,
        2400,
        4800
      ]
    },
    {
      "id": "SU2:g=0.85:eta=1",
      "theory": "SU2",
      "g": "0.85",
      "eta": "1",
      "cutoffs": [
        20,
        40,
        80,
        160,
        320
      ],
      "grids": [
        600,
        1200,
        2400,
        4800
      ]
    },
    {
      "id": "SU2:g=1.25:eta=0",
      "theory": "SU2",
      "g": "1.25",
      "eta": "0",
      "cutoffs": [
        20,
        40,
        80,
        160,
        320
      ],
      "grids": [
        600,
        1200,
        2400,
        4800
      ]
    },
    {
      "id": "SU2:g=1.25:eta=0.5",
      "theory": "SU2",
      "g": "1.25",
      "eta": "0.5",
      "cutoffs": [
        20,
        40,
        80,
        160,
        320
      ],
      "grids": [
        600,
        1200,
        2400,
        4800
      ]
    },
    {
      "id": "SU2:g=1.25:eta=1",
      "theory": "SU2",
      "g": "1.25",
      "eta": "1",
      "cutoffs": [
        20,
        40,
        80,
        160,
        320
      ],
      "grids": [
        600,
        1200,
        2400,
        4800
      ]
    },
    {
      "id": "SU2:g=2.50:eta=0",
      "theory": "SU2",
      "g": "2.50",
      "eta": "0",
      "cutoffs": [
        20,
        40,
        80,
        160,
        320
      ],
      "grids": [
        600,
        1200,
        2400,
        4800
      ]
    },
    {
      "id": "SU2:g=2.50:eta=0.5",
      "theory": "SU2",
      "g": "2.50",
      "eta": "0.5",
      "cutoffs": [
        20,
        40,
        80,
        160,
        320
      ],
      "grids": [
        600,
        1200,
        2400,
        4800
      ]
    },
    {
      "id": "SU2:g=2.50:eta=1",
      "theory": "SU2",
      "g": "2.50",
      "eta": "1",
      "cutoffs": [
        20,
        40,
        80,
        160,
        320
      ],
      "grids": [
        600,
        1200,
        2400,
        4800
      ]
    },
    {
      "id": "U1:g=0.125:eta=0",
      "theory": "U1",
      "g": "0.125",
      "eta": "0",
      "cutoffs": [
        40,
        80,
        160,
        320,
        640
      ],
      "grids": [
        600,
        1200,
        2400,
        4800
      ]
    },
    {
      "id": "U1:g=0.125:eta=0.5",
      "theory": "U1",
      "g": "0.125",
      "eta": "0.5",
      "cutoffs": [
        40,
        80,
        160,
        320,
        640
      ],
      "grids": [
        600,
        1200,
        2400,
        4800
      ]
    },
    {
      "id": "U1:g=0.125:eta=1",
      "theory": "U1",
      "g": "0.125",
      "eta": "1",
      "cutoffs": [
        40,
        80,
        160,
        320,
        640
      ],
      "grids": [
        600,
        1200,
        2400,
        4800
      ]
    },
    {
      "id": "U1:g=0.25:eta=0",
      "theory": "U1",
      "g": "0.25",
      "eta": "0",
      "cutoffs": [
        40,
        80,
        160,
        320,
        640
      ],
      "grids": [
        600,
        1200,
        2400,
        4800
      ]
    },
    {
      "id": "U1:g=0.25:eta=0.5",
      "theory": "U1",
      "g": "0.25",
      "eta": "0.5",
      "cutoffs": [
        40,
        80,
        160,
        320,
        640
      ],
      "grids": [
        600,
        1200,
        2400,
        4800
      ]
    },
    {
      "id": "U1:g=0.25:eta=1",
      "theory": "U1",
      "g": "0.25",
      "eta": "1",
      "cutoffs": [
        40,
        80,
        160,
        320,
        640
      ],
      "grids": [
        600,
        1200,
        2400,
        4800
      ]
    },
    {
      "id": "U1:g=0.40:eta=0",
      "theory": "U1",
      "g": "0.40",
      "eta": "0",
      "cutoffs": [
        40,
        80,
        160,
        320,
        640
      ],
      "grids": [
        600,
        1200,
        2400,
        4800
      ]
    },
    {
      "id": "U1:g=0.40:eta=0.5",
      "theory": "U1",
      "g": "0.40",
      "eta": "0.5",
      "cutoffs": [
        40,
        80,
        160,
        320,
        640
      ],
      "grids": [
        600,
        1200,
        2400,
        4800
      ]
    },
    {
      "id": "U1:g=0.40:eta=1",
      "theory": "U1",
      "g": "0.40",
      "eta": "1",
      "cutoffs": [
        40,
        80,
        160,
        320,
        640
      ],
      "grids": [
        600,
        1200,
        2400,
        4800
      ]
    },
    {
      "id": "U1:g=0.60:eta=0",
      "theory": "U1",
      "g": "0.60",
      "eta": "0",
      "cutoffs": [
        40,
        80,
        160,
        320,
        640
      ],
      "grids": [
        600,
        1200,
        2400,
        4800
      ]
    },
    {
      "id": "U1:g=0.60:eta=0.5",
      "theory": "U1",
      "g": "0.60",
      "eta": "0.5",
      "cutoffs": [
        40,
        80,
        160,
        320,
        640